{
  "$schema": "https://json-schema.org/draft/2020-12/schema",
  "$id": "urn:unclaimed-platform:schema:ny-osc-seventh-attempt-authorization-proposal:1.0.0",
  "title": "NY OSC Seventh Bounded Attempt Authorization Proposal v1",
  "type": "object",
  "additionalProperties": false,
  "required": [
    "schema_version",
    "artifact_id",
    "artifact_version",
    "prepared_on",
    "status",
    "source_id",
    "request_scope",
    "canonical_baseline",
    "preceding_attempt",
    "policy_basis",
    "verified_synthetic_capability",
    "proposed_real_runtime_package",
    "execution_objective",
    "fresh_preflight",
    "proposed_execution_bounds",
    "proposed_privacy_scope",
    "future_human_gates",
    "implementation_gate",
    "authorization_does_not_grant",
    "next_action"
  ],
  "properties": {
    "schema_version": {
      "const": "1.0.0"
    },
    "artifact_id": {
      "const": "ny.osc.owner_name_file.seventh_bounded_attempt_authorization_proposal"
    },
    "artifact_version": {
      "const": "1.0.0"
    },
    "prepared_on": {
      "const": "2026-09-21"
    },
    "status": {
      "const": "PROPOSED_NOT_AUTHORIZED"
    },
    "source_id": {
      "const": "ny.osc.unclaimed_funds.owner_name_file"
    },
    "request_scope": {
      "const": {
        "repository_only": true,
        "source_network_access_performed": false,
        "remote_preflight_performed": false,
        "download_performed": false,
        "owner_file_opened": false,
        "owner_pii_processed": false,
        "approval_artifacts_created": false,
        "gate7_runner_created": false,
        "real_runtime_created": false
      }
    },
    "canonical_baseline": {
      "const": {
        "branch": "ny-osc-raw-literal-runtime-integration-synthetic-offline",
        "checkpoint": "c03f2af4a0fc97232ac5be0abcfe3dd6ae47340a",
        "ci_run_id": 35642325234,
        "ci_conclusion": "SUCCESS",
        "synthetic_runtime_contract_version": "1.3.0",
        "authorization_contract_version": "1.2.0",
        "quote_dialect_mode": "DOCUMENTED_WIDTH_RAW_LITERAL_POLICY",
        "synthetic_runtime_human_review_gate": "HUMAN_REVIEW_NY_OSC_RAW_LITERAL_RUNTIME_INTEGRATION_SYNTHETIC_OFFLINE",
        "synthetic_runtime_human_review_result": "PASS"
      }
    },
    "preceding_attempt": {
      "const": {
        "attempt_number": 6,
        "execution_result_path": "sources/evidence/ny_osc_owner_name_file_sixth_attempt_execution_result.v1.json",
        "status": "BLOCKED",
        "execution_semantics": "FAIL_CLOSED",
        "reason_code": "QUOTE_DIALECT_AMBIGUOUS",
        "documented_layout_field_count": 14,
        "aggregate_complete_record_count_before_block": 165438,
        "property_type_ascii_record_count_before_block": 165438,
        "raw_field_count_at_block": 14,
        "quote_aware_field_count_at_block": 6,
        "raw_pipe_count_at_block": 13,
        "quote_aware_structural_pipe_count_at_block": 5,
        "suppressed_pipe_count_at_block": 8,
        "quote_byte_count_at_block": 1,
        "quote_open_event_count_at_block": 1,
        "quote_close_event_count_at_block": 0,
        "ended_inside_quote_at_block": true,
        "archive_byte_count": 409477526,
        "archive_member_count": 1,
        "selected_member_uncompressed_bytes": 1939569781,
        "transient_local_approval_consumed": true,
        "transient_pii_approval_consumed": true,
        "approvals_reusable": false,
        "retry_authorized": false,
        "raw_file_logically_deleted": true,
        "physical_secure_erasure_guaranteed": false,
        "owner_values_returned": false
      }
    },
    "policy_basis": {
      "const": {
        "decision_id": "D-011",
        "policy": "RAW_PIPE_WITH_DOUBLE_QUOTE_LITERAL",
        "parser_mode": "DOCUMENTED_WIDTH_RAW_LITERAL_POLICY",
        "source_truth_about_double_quote": "UNKNOWN",
        "sixth_discriminating_evidence": "RAW_14_VS_QUOTE_AWARE_6",
        "policy_is_product_owner_fallback_not_osc_source_truth": true,
        "automatic_repair_authorized": false,
        "automatic_retry_authorized": false,
        "automatic_source_acceptance_authorized": false
      }
    },
    "verified_synthetic_capability": {
      "const": {
        "authorization_contract_path": "schemas/agents/ny_transient_local_execution_authorization_v1_2.schema.json",
        "authorization_contract_version": "1.2.0",
        "authorization_mode": "SYNTHETIC_TEST",
        "real_mode_allowed": false,
        "result_contract_path": "schemas/agents/ny_transient_local_execution_result_v1_3.schema.json",
        "result_contract_version": "1.3.0",
        "runtime_path": "src/unclaimed_platform/adapters/sources/ny_owner_name_transient_local_execution_v1_3.py",
        "runtime_function": "execute_transient_local_file_discovery_v1_3",
        "quote_dialect_mode": "DOCUMENTED_WIDTH_RAW_LITERAL_POLICY",
        "quote_dialect_diagnostic_policy": "REQUIRED_NULL",
        "quote_specific_reason_codes_allowed": false,
        "real_authorization_builder_present": false,
        "cli_present": false,
        "gate7_runner_present": false,
        "targeted_runtime_mypy_verified": true,
        "synthetic_contract_tests_verified": true,
        "real_owner_file_used_for_runtime_integration": false
      }
    },
    "proposed_real_runtime_package": {
      "const": {
        "status": "REQUIRED_BEFORE_ANY_SEVENTH_APPROVAL_OR_PREFLIGHT",
        "version_additive": true,
        "historical_synthetic_contracts_must_remain_unchanged": true,
        "authorization_contract": {
          "proposed_path": "schemas/agents/ny_transient_local_execution_authorization_v1_3.schema.json",
          "proposed_version": "1.3.0",
          "mode": "AUTHORIZED_REAL_ONCE",
          "attempt_number": 7,
          "quote_dialect_mode": "DOCUMENTED_WIDTH_RAW_LITERAL_POLICY",
          "approval_binding_required": true,
          "synthetic_mode_allowed": false
        },
        "result_contract": {
          "proposed_path": "schemas/agents/ny_transient_local_execution_result_v1_4.schema.json",
          "proposed_version": "1.4.0",
          "execution_mode": "AUTHORIZED_REAL_ONCE",
          "attempt_number": 7,
          "schema_discovery_quote_dialect_mode": "DOCUMENTED_WIDTH_RAW_LITERAL_POLICY",
          "quote_dialect_diagnostic_policy": "REQUIRED_NULL",
          "structural_diagnostic_contract_version": "1.0.0",
          "unknown_reason_codes_fail_closed": true
        },
        "runtime": {
          "proposed_path": "src/unclaimed_platform/adapters/sources/ny_owner_name_transient_local_execution_v1_4.py",
          "proposed_function": "execute_transient_local_file_discovery_v1_4",
          "proposed_real_authorization_builder": "build_real_execution_authorization_v1_3",
          "cli_allowed": false,
          "direct_network_client_allowed": false,
          "current_v1_3_runtime_retarget_allowed": false
        },
        "gate7_runner": {
          "proposed_path": "scripts/ny_osc_gate7_transient_local.ps1",
          "proposed_status": "NOT_CREATED",
          "must_be_bound_to_reviewed_proposal_checkpoint": true,
          "must_be_bound_to_verified_runtime_checkpoint": true,
          "must_verify_fresh_single_use_approvals": true,
          "must_verify_fresh_preflight_receipt": true,
          "direct_network_client_allowed": false
        }
      }
    },
    "execution_objective": {
      "const": {
        "primary_question": "DOES_THE_DOCUMENTED_14_FIELD_LAYOUT_VALIDATE_ON_THE_REAL_OWNER_FILE_UNDER_DOCUMENTED_WIDTH_RAW_LITERAL_POLICY",
        "success_status": "DISCOVERED",
        "success_reason_code": "DOCUMENTED_14_FIELD_LAYOUT_CONFIRMED",
        "unexpected_field_count_behavior": "BLOCK_AND_STOP",
        "property_type_shape_failure_behavior": "BLOCK_AND_STOP",
        "quote_specific_reason_behavior": "INTEGRATION_ERROR_AND_STOP",
        "other_non_success_reason_behavior": "BLOCK_AND_STOP",
        "automatic_row_repair_allowed": false,
        "automatic_row_skip_allowed": false,
        "automatic_parser_widening_allowed": false,
        "automatic_source_acceptance_allowed": false,
        "automatic_retry_allowed": false
      }
    },
    "fresh_preflight": {
      "const": {
        "required_immediately_before_execution": true,
        "performed_for_this_proposal": false,
        "remote_access_authorized_by_this_proposal": false,
        "historical_listing_for_comparison_only": {
          "remote_listing_name": "FINDERS.zip",
          "size_display": "390.51 MB",
          "last_modified_display": "9/16/2026, 1:33:31 PM",
          "evidence_path": "sources/evidence/ny_osc_owner_name_file_sixth_fresh_listing_preflight_receipt.v1.json",
          "observed_on_attempt": 6,
          "performed_at_utc": "2026-09-21T08:06:57Z"
        },
        "freshness_window_seconds": 900,
        "required_result": "EXACT_MATCH_OR_STOP",
        "drift_behavior": "STOP_BEFORE_DOWNLOAD_AND_REFRESH_PROPOSAL",
        "separate_preflight_authorization_required": true
      }
    },
    "proposed_execution_bounds": {
      "const": {
        "attempt_number": 7,
        "downloads_max": 1,
        "retries_max": 0,
        "max_download_bytes": 450000000,
        "max_uncompressed_bytes": 2000000000,
        "max_archive_members": 1,
        "text_members_required_exactly": 1,
        "expected_delimiter": "|",
        "expected_documented_field_count": 14,
        "parser_chunk_bytes": 65536,
        "required_transient_execution_authorization_contract_version": "1.3.0",
        "required_execution_result_contract_version": "1.4.0",
        "required_quote_dialect_mode": "DOCUMENTED_WIDTH_RAW_LITERAL_POLICY",
        "required_structural_diagnostic_contract_version": "1.0.0",
        "quote_dialect_diagnostic_required_null": true,
        "automatic_widening_allowed": false,
        "automatic_retry_allowed": false
      }
    },
    "proposed_privacy_scope": {
      "const": {
        "transient_local_file_only": true,
        "durable_raw_persistence_allowed": false,
        "repository_persistence_allowed": false,
        "cloud_sync_allowed": false,
        "chat_upload_allowed": false,
        "immediate_logical_deletion_required": true,
        "transient_owner_pii_in_memory_allowed": true,
        "owner_rows_persistence_allowed": false,
        "owner_field_decoding_allowed": false,
        "owner_field_buffering_allowed": false,
        "owner_field_logging_allowed": false,
        "row_specific_human_inspection_allowed": false,
        "derived_non_pii_schema_metadata_persistence_allowed": true,
        "structural_diagnostic_persistence_allowed": true,
        "quote_dialect_diagnostic_persistence_allowed": false,
        "physical_secure_erasure_guaranteed": false
      }
    },
    "future_human_gates": {
      "const": [
        {
          "sequence": 1,
          "gate": "HUMAN_REVIEW_NY_OSC_SEVENTH_ATTEMPT_OFFLINE_PROPOSAL",
          "status": "PENDING",
          "grants": "PROPOSAL_ACCEPTANCE_ONLY"
        },
        {
          "sequence": 2,
          "gate": "IMPLEMENT_AND_REVIEW_NY_OSC_SEVENTH_REAL_RUNTIME_PACKAGE_OFFLINE",
          "status": "NOT_STARTED",
          "grants": "OFFLINE_REAL_CAPABLE_RUNTIME_PACKAGE_ONLY"
        },
        {
          "sequence": 3,
          "gate": "HUMAN_NY_OSC_SEVENTH_TRANSIENT_LOCAL_FILE_RETENTION_AUTHORIZATION",
          "approval_phrase": "APPROVO NY OSC SEVENTH TRANSIENT LOCAL FILE BOUNDED ONCE",
          "status": "NOT_GRANTED",
          "single_use": true,
          "reusable": false,
          "retry_authorized": false
        },
        {
          "sequence": 4,
          "gate": "HUMAN_NY_OSC_SEVENTH_TRANSIENT_PII_AUTHORIZATION",
          "approval_phrase": "APPROVO NY OSC OWNER NAME FILE SEVENTH BOUNDED TRANSIENT PII ATTEMPT ONCE",
          "status": "NOT_GRANTED",
          "single_use": true,
          "reusable": false,
          "retry_authorized": false
        },
        {
          "sequence": 5,
          "gate": "HUMAN_NY_OSC_SEVENTH_FRESH_LISTING_PREFLIGHT_AUTHORIZATION",
          "approval_phrase": "AUTHORIZE_NY_OSC_SEVENTH_FRESH_LISTING_PREFLIGHT",
          "status": "NOT_GRANTED",
          "scope": "PREFLIGHT_ONLY_NO_DOWNLOAD_NO_OWNER_FILE_OPEN"
        },
        {
          "sequence": 6,
          "gate": "HUMAN_NY_OSC_SEVENTH_EXECUTION_AUTHORIZATION",
          "approval_phrase": "AUTHORIZE_NY_OSC_SEVENTH_BOUNDED_EXECUTION_ONCE",
          "status": "NOT_GRANTED",
          "single_use": true,
          "reusable": false,
          "retry_authorized": false,
          "grants": "ONE_BOUND_EXECUTION_AFTER_EXACT_MATCH_FRESH_PREFLIGHT"
        }
      ]
    },
    "implementation_gate": {
      "const": {
        "seventh_attempt_real_runtime_status": "NOT_CREATED",
        "seventh_attempt_runner_status": "NOT_CREATED",
        "seventh_attempt_approval_contract_status": "NOT_CREATED",
        "seventh_attempt_approval_artifacts_status": "NOT_CREATED",
        "seventh_attempt_preflight_receipt_status": "NOT_CREATED",
        "execution_status": "BLOCKED_PROPOSAL_ONLY",
        "sixth_attempt_runner_reuse_allowed": false,
        "sixth_attempt_approval_reuse_allowed": false,
        "synthetic_v1_2_authorization_retarget_allowed": false,
        "synthetic_v1_3_result_retarget_allowed": false,
        "synthetic_v1_3_runtime_retarget_allowed": false,
        "shared_raw_literal_schema_discovery_reuse_allowed": true,
        "source_access_allowed": false
      }
    },
    "authorization_does_not_grant": {
      "const": {
        "real_runtime_implementation": false,
        "approval_creation": false,
        "source_network_access": false,
        "remote_preflight": false,
        "download": false,
        "owner_pii_processing": false,
        "seventh_attempt_execution": false,
        "sixth_retry": false,
        "source_activation": false,
        "production_classification_activation": false,
        "identity_resolution": false,
        "beneficiary_matching": false,
        "outreach": false,
        "fee_agreement": false,
        "representation": false,
        "claim_activity": false
      }
    },
    "next_action": {
      "const": "HUMAN_REVIEW_NY_OSC_SEVENTH_ATTEMPT_OFFLINE_PROPOSAL"
    }
  }
}
